Question, Tag
The matrices begin bmatrix cos heta amp amp sin heta sin heta amp amp cos heta end bmatrix and begin bmatrix a amp amp 0 0 amp amp b end bmatrix commute under multiplication if a b ext or heta n pi n an integer always never if a cos heta b sin heta  ,Matrices
 Let Ax b be a system of linear equations where A is an m imes n matrix and b is a m imes 1 column vector and X is an n imes1 column vector of unknowns Which of the following is false The system has a solution if and only if both A and the augmented matrix Ab have the same rank If m lt n and b is the zero vector then the system has infinitely many solutions If m n and b is a non zero vector then the system has a unique solution The system will have only a trivial solution when m n b is the zero vector and ext rank A n  ,System Of Equations
 Consider the following set of equations x 2y 5 4x 8y 12 3x 6y 3z 15 This set has unique solution has no solution has finite number of solutions has infinite number of solutions  ,System Of Equations
Consider the following system of linear equations left begin array ccc 2 amp 1 amp 4 4 amp 3 amp 12 1 amp 2 amp 8 end array right left begin array ccc x y z end array right left begin array ccc alpha 5 7 end array right Notice that the second and the third columns of the coefficient matrix are linearly dependent For how many values of alpha does this system of equations have infinitely many solutions 0 1 2 3 ,System Of Equations
How many solutions does the following system of linear equations have x 5y 1 x y 2 x 3y 3 infinitely many two distinct solutions unique none ,System Of Equations
What values of x y and z satisfy the following system of linear equations begin bmatrix 1 amp 2 amp 3 1 amp 3 amp 4 2 amp 2 amp 3 end bmatrix begin bmatrix x y z end bmatrix begin bmatrix 6 8 12 end bmatrix x 6 y 3 z 2 x 12 y 3 z 4 x 6 y 6 z 4 x 12 y 3 z 0 ,System Of Equations
Consider the following system of linear equations 2x_1 x_2 3x_3 1 3x_1 2x_2 5x_3 2 x_1 4x_2 x_3 3 The system of equations has no solution a unique solution more than one but a finite number of solutions an infinite number of solutions ,System Of Equations
The following system of equations x_1 x_2 2x_3 1 x_1 2x_2 3x_3 2 x_1 4x_2 u03b1x_3 4 has a unique solution The only possible value s for u03b1 is are 0 either 0 or 1 one of 0 1 or 1 any real number ,System Of Equations
Consider the set of column vectors defined by X left x in R 3 mid x_1 x_2 x_3 0 ext where x T left x_1 x_2 x_3 right T right Which of the following is TRUE left left 1 1 0 right T left 1 0 1 right T right is a basis for the subspace X left left 1 1 0 right T left 1 0 1 right T right is a linearly independent set but it does not span X and therefore is not a basis of X X is not a subspace of R 3 None of the above ,Vector Space
If V_1 and V_2 are 4 dimensional subspaces of a 6 dimensional vector space V then the smallest possible dimension of V_1 cap V_2 is _____ ,Vector Space
Let u and v be two vectors in R2 whose Euclidean norms satisfy left u right 2 left v right What is the value of alpha such that w u alpha v bisects the angle between u and v 2 frac 1 2 1 frac 1 2 ,Vector Space
Box P has 2 red balls and 3 blue balls and box Q has 3 red balls and 1 blue ball A ball is selected as follows i select a box ii choose a ball from the selected box such that each ball in the box is equally likely to be chosen The probabilities of selecting boxes P and Q are dfrac 1 3 and dfrac 2 3 respectively Given that a ball selected in the above process is a red ball the probability that it came from the box P is dfrac 4 19 dfrac 5 19 dfrac 2 9 dfrac 19 30 ,Bayes Theorem
Suppose a fair six sided die is rolled once If the value on the die is 1 2 or 3 the die is rolled a second time What is the probability that the sum total of values that turn up is at least 6 dfrac 10 21 dfrac 5 12 dfrac 2 3 dfrac 1 6 ,Bayes Theorem
You are given three coins one has heads on both faces the second has tails on both faces and the third has a head on one face and a tail on the other You choose a coin at random and toss it and it comes up heads The probability that the other face is tails is dfrac 1 4  dfrac 1 3  dfrac 1 2  dfrac 2 3  ,Bayes Theorem
An automobile plant contracted to buy shock absorbers from two suppliers X and Y X supplies 60 and Y supplies 40 of the shock absorbers All shock absorbers are subjected to a quality test The ones that pass the quality test are considered reliable Of X u2019s shock absorbers 96 are reliable Of Y u2019s shock absorbers 72 are reliable The probability that a randomly chosen shock absorber which is found to be reliable is made by Y is A 0 288 B 0 334 C 0 667 D 0 720,Bayes Theorem
A random bit string of length n is constructed by tossing a fair coin n times and setting a bit to 0 or 1 depending on outcomes head and tail respectively The probability that two such randomly generated strings are not identical is frac 1 2 n 1 frac 1 n frac 1 n 1 frac 1 2 n ,Binomial Distribution
An unbiased coin is tossed repeatedly until the outcome of two successive tosses is the same Assuming that the trials are independent the expected number of tosses is 3 4 5 6 ,Binomial Distribution
For each element in a set of size 2n an unbiased coin is tossed The 2n coin tosses are independent An element is chosen if the corresponding coin toss was a head The probability that exactly n elements are chosen is frac 2n mathrm C _n 4 n frac 2n mathrm C _n 2 n frac 1 2n mathrm C _n frac 1 2 ,Binomial Distribution
When a coin is tossed the probability of getting a Head is p 0 lt p lt 1 Let N be the random variable denoting the number of tosses till the first Head appears including the toss where the Head appears Assuming that successive tosses are independent the expected value of N is dfrac 1 p dfrac 1 1 p dfrac 1 p 2 dfrac 1 1 p 2 ,Binomial Distribution
Let A and B be any two arbitrary events then which one of the following is true P A cap B P A P B P A cup B P A P B P A mid B P A cap B P B P A cup B leq P A P B  ,Conditional Probability
Suppose that a shop has an equal number of LED bulbs of two different types The probability of an LED bulb lasting more than 100 hours given that it is of Type 1 is 0 7 and given that it is of Type 2 is 0 4 The probability that an LED bulb chosen uniformly at random lasts more than 100 hours is _________ ,Conditional Probability
 P and Q are considering to apply for a job The probability that P applies for the job is dfrac 1 4 the probability that P applies for the job given that Q applies for the job is dfrac 1 2 and the probability that Q applies for the job given that P applies for the job is dfrac 1 3 Then the probability that P does not apply for the job given that Q does not apply for this job is left dfrac 4 5 right left dfrac 5 6 right left dfrac 7 8 right left dfrac 11 12 right ,Conditional Probability
Karan tells truth with probability dfrac 1 3 and lies with probability dfrac 2 3 Independently Arjun tells truth with probability dfrac 3 4 and lies with probability dfrac 1 4 Both watch a cricket match Arjun tells you that India won Karan tells you that India lost What probability will you assign to India s win left dfrac 1 2 right left dfrac 2 3 right left dfrac 3 4 right left dfrac 5 6 right left dfrac 6 7 right ,Conditional Probability
Amar and Akbar both tell the truth with probability dfrac 3 4 and lie with probability dfrac 1 4 Amar watches a test match and talks to Akbar about the outcome Akbar in turn tells Anthony Amar told me that India won What probability should Anthony assign to India s win left dfrac 9 16 right left dfrac 6 16 right left dfrac 7 16 right left dfrac 10 16 right None of the above ,Conditional Probability
Suppose that the expectation of a random variable X is 5 Which of the following statements is true  There is a sample point at which X has the value 5 There is a sample point at which X has value greater than 5 There is a sample point at which X has a value greater than equal to 5 None of the above  ,Expectation
An examination paper has 150 multiple choice questions of one mark each with each question having four choices Each incorrect answer fetches 0 25 marks Suppose 1000 students choose all their answers randomly with uniform probability The sum total of the expected marks obtained by all these students is 0 2550 7525 9375 ,Expectation
We are given a set X X_1 X_n  where X_i 2 i   A sample  S subseteq X  is drawn by   selecting each X_i   independently with probability P_i frac 1 2   The expected value of the smallest number in sample S is left frac 1 n right 2 sqrt n n ,Expectation
Consider an undirected random graph of eight vertices The probability that there is an edge between a pair of vertices is dfrac 1 2 What is the expected number of unordered cycles of length three dfrac 1 8 1 7 8 ,Expectation
Assume that you are flipping a fair coin i e probability of heads or tails is equal Then the expected number of coin flips required to obtain two consecutive heads for the first time is 4 3 6 10 5 ,Expectation
 Ram has a fair coin i e a toss of the coin results in either head or tail and each event happens with probability exactly half 1 2 He repeatedly tosses the coin until he gets heads in two consecutive tosses The expected number of coin tosses that Ram does is 2 4 6 8 None of the above ,Expectation
Let X and Y be two exponentially distributed and independent random variables with mean u03b1 and u03b2 respectively If Z min X Y then the mean of Z is given by left dfrac 1 alpha beta right min alpha beta left dfrac alpha beta alpha beta right alpha beta ,Exponential Distribution
Let X be a random variable following normal distribution with mean 1 and variance 4 Let Y be another normal variable with mean 1 and variance unknown If P X u2264 1 P Y u2265 2 the standard deviation of Y is 3 2 sqrt 2 1 ,Normal Distribution
The minimum number of cards to be dealt from an arbitrarily shuffled deck of 52 cards to guarantee that three cards are from same  suit is 3 8 9 12 ,Permutation Combination
In a multi user operating system on an average 20 requests are made to use a particular resource per hour The arrival of requests follows a Poisson distribution The probability that either one three or five requests are made in 45 minutes is given by 6 9 imes 10 6 imes e 20 1 02 imes 10 6 imes e 20 6 9 imes 10 3 imes e 20 1 02 imes 10 3 imes e 20 ,Poisson Distribution
Suppose p is the number of cars per minute passing through a certain road junction between 5 PM and 6 PM and p has a Poisson distribution with mean 3 What is the probability of observing fewer than 3 cars during any given minute in this interval A dfrac 8 2e 3 B dfrac 9 2e 3 C dfrac 17 2e 3 D dfrac 26 2e 3 ,Poisson Distribution
If a random variable X has a Poisson distribution with mean 5 then the expectation E X 2 2 equals ___ ,Poisson Distribution
A probability density function on the interval a 1 is given by 1 x 2 and outside this interval the value of the function is zero The value of a is _________ ,Probability
 Consider the following experiment Step 1 Flip a fair coin twice Step 2 If the outcomes are TAILS HEADS then output Y and stop Step 3 If the outcomes are either HEADS HEADS or HEADS TAILS then output N and stop Step 4 If the outcomes are TAILS TAILS then go to Step 1 The probability that the output of the experiment is Y is up to two decimal places ____________    ,Probability
The security system at an IT office is composed of 10 computers of which exactly four are working To check whether the system is functional the officials inspect four of the computers picked at random without replacement The system is deemed functional if at least three of the four computers inspected are working Let the probability that the system is deemed functional be denoted by  p Then 100p  _____________  ,Probability
 The probability of an event B is P_1 The probability that events A and B occur together is P_2  while the probability that A and bar B occur together is P_3  The probability of the event A in terms of P_1 P_2 and P_3 is _____________ ,Probability
 A bag contains 10 white balls and 15 black balls Two balls are drawn in succession The probability that one of them is black and the other is white is frac 2 3 frac 4 5 frac 1 2 frac 1 3  ,Probability
Two dice are thrown simultaneously The probability that at least one of them will have 6 facing up is frac 1 36 frac 1 3 frac 25 36 frac 11 36  ,Probability
 The probability that top and bottom cards of a randomly shuffled deck are both aces is frac 4 52 imes frac 4 52 frac 4 52 imes frac 3 52 frac 4 52 imes frac 3 51 frac 4 52 imes frac 4 51  ,Probability
 Let f x be the continuous probability density function of a random variable x the probability that a lt x leq b is f b a f b f a int limits_a b f x dx int limits_a b xf x dx ,Random Variable
If the difference between the expectation of the square of a random variable left E left X 2 right right and he square of the expectation of the random variable left E left X right right 2 is denoted by R then A R 0 B R lt 0 C R geq 0 D R gt 0 ,Random Variable
Consider a finite sequence of random values X x_1 x_2 dots x_n Let mu_x be the mean and sigma_x be he standard deviation of X Let another finite sequence Y of equal length be derived from this as y_i a x_i b where a and b are positive constants Let mu_y be the mean and sigma_y be the standard deviation of this sequence Which one of the following statements is  INCORRECT A  Index position of mode of X in X is the same as the index position of mode of Y in Y B  Index position of median of X in X is the same as the index position of median  of Y in Y C  mu_y a mu_x b D  sigma_y a sigma_x b ,Random Variable
Consider a random variable X that takes values 1 and u22121 with probability 0 5 each The values of the cumulative distribution function F x at x u22121 and 1 are A 0 and 0 5 B 0 and 1 C 0 5 and 1 D 0 25 and 0 75,Random Variable
Suppose X_i for i 1 2 3 are independent and identically distributed random variables whose probability mass functions are Pr X_i 0 Pr X_i 1 frac 1 2 ext for i 1 2 3 Define another random variable Y X_1X_2 oplus X_3 where oplus denotes XOR Then Pr Y 0 mid X_3 0 ______ ,Random Variable
Let X be a Gaussian random variable with mean 0 and variance sigma 2 Let Y max left X 0 right where max left a b right is the maximum of a and b The median of Y is ______________ ,Random Variable
For any discrete random variable X with probability mass function P X j p_j p_j geq 0 j in 0 dots N and Sigma_ j 0 N p_j 1 define the polynomial function g_x z Sigma_ j 0 N p_j z j For a certain discrete random variable Y there exists a scalar beta in 0 1 such that g_y z 1 beta beta z N The expectation of Y is N beta 1 beta N beta N 1 beta Not expressible in terms of N and beta alone  ,Random Variable
If  mid 4X 7 mid 5 then the values of 2 mid X mid mid X mid is quad 2 left dfrac 1 3 right left dfrac 1 2 right 3 left dfrac 3 2 right 9 left dfrac 2 3 right 9 ,Absolute Value
If x is real and mid x 2 2x 3 mid 11 then possible values of mid x 3 x 2 x mid include 2 4 2 14 4 52 14 52 ,Absolute Value
The expression large frac x y x y 2 is equal to The maximum of x and y The minimum of x and y 1 None of the above ,Absolute Value
At what time between 6 a m and 7 a m will the minute hand and hour hand of a clock make an angle closest to 60 u00b0 6 22 a m 6 27 a m 6 38 a m 6 45 a m ,Clock Time
The cost function for a product in a firm is given by 5q 2 where q is the amount of production The firm can sell the product at a market price of u20b9 50 per unit The number of units to be produced by the firm such that the profit is maximized is A 5 B 10 C 15 D 25,Cost Market Price
 P Q R and S are four types of dangerous microbes recently found in a human habitat The area of each circle with its diameter printed in brackets represents the growth of a single microbe surviving human immunity system within 24 hours of entering the body The danger to human beings varies proportionately with the toxicity potency and growth attributed to a microbe shown in the figure below A pharmaceutical company is contemplating the development of a vaccine against the most dangerous microbe Which microbe should the company target in its first attempt P Q R S ,Data Interpretation
In a survey 300 respondents were asked whether they own a vehicle or not If yes they were further asked to mention whether they own a car or scooter or both Their responses are tabulated below What percent of respondents do not own a scooter   Men Women Own vehicle Car 40 34 Scooter 30 20 Both 60 46 Do not own vehicle 20 50 ,Data Interpretation
The ratio of male to female students in a college for five years is plotted in the following line graph If the number of female students doubled in 2009 by what percent did the number of male students increase in 2009  ,Data Interpretation
The table below has question wise data on the performance of students in an examination The marks for each question are also listed There is no negative or partial marking in the examination Q No Marks Answered Correctly Answered Wrongly Not Attempted 1 2 21 17 6 2 3 15 27 2 3 2 23 18 3 What is the average of the marks obtained by the class in the examination 1 34 1 74 3 02 3 91 ,Data Interpretation
The pie chart below has the breakup of the number of students from different departments in an engineering college for the year 2012 The proportion of male to female students in each department is 5 4 There are 40 males in Electrical Engineering What is the difference between the numbers of female students in the civil department and the female students in the Mechanical department   ,Data Interpretation
 The exports and imports in crores of Rs of a country from the year 2000 to 2007 are given in the following bar chart In which year is the combined percentage increase in imports and exports the highest ,Data Interpretation
 f x 1 x 1 f x 1 x 1 f x 2 x 1 f x 2 x 1 ,Data Interpretation
Four branches of a company are located at M N O and P M is north of N at a distance of 4 km P is south of O at a distance of 2 km N is southeast of O by 1 km What is the distance between M and P in km 5 34 6 74 28 5 45 49 ,Direction Sense
There are five buildings called V W X Y and Z in a row not necessarily in that order V is to the West of W Z is to the East of X and the West of V W is to the West of Y Which is the building in the middle V W X Y ,Direction Sense
Out of all the 2 digit integers between 1 and 100 a 2 digit number has to be selected at random What is the probability that the selected number is not divisible by 7 left dfrac 13 90 right left dfrac 12 90 right left dfrac 78 90 right left dfrac 77 90 right ,Factors
What is the average of all multiples of 10 from 2 to 198 90 100 110 120 ,Factors
 A cube is built using 64 cubic blocks of side one unit After it is built one cubic block is removed from every corner of the cube The resulting surface area of the body in square units after the removal is ________ 56 64 72 96  ,Geometry
When a point inside of a tetrahedron a solid with four triangular surfaces is connected by straight lines to its corners how many new internal planes are created with these lines ,Geometry
In a triangle PQR PS is the angle bisector of angle QPR ext and angle QPS 60 circ What is the length of PS   left dfrac q r qr right left dfrac qr q r right large sqrt q 2 r 2 left dfrac q r 2 qr right ,Geometry
Hari H Gita G Irfan I and Saira S are siblings i e brothers and sisters All were born on 1st January The age difference between any two successive siblings that is born one after another is less than three years Given the following facts Hari s age Gita s age gt Irfan s age Saira s age The age difference between Gita and Saira is one year However Gita is not the oldest and Saira is not the youngest There are no twins In what order they were born oldest first HSIG SGHI IGSH IHSG ,Inference
 X is a 30 digit number starting with the digit 4 followed by the digit 7 Then the number X 3 will have 90 digits 91 digits 92 digits 93 digits ,No Of Digits
Find the sum of the expression frac 1 sqrt 1 sqrt 2 frac 1 sqrt 2 sqrt 3 frac 1 sqrt 3 sqrt 4 frac 1 sqrt 80 sqrt 81 7 8 9 10 ,Number Series
The value of sqrt 12 sqrt 12 sqrt 12 dots is 3 464 3 932 4 000 4 444 ,Number Series
Round trip tickets to a tourist destination are eligible for a discount of 10 on the total fare In addition groups of 4 or more get a discount of 5 on the total fare If the one way single person fare is Rs 100 a group of 5 tourists purchasing round trip tickets will be charged Rs __________,Percentage
The Gross Domestic Product GDP in Rupees grew at 7 during 2012 2013 For international comparison the GDP is compared in US Dollars USD after conversion based on the market exchange rate During the period 2012 2013 the exchange rate for the USD increased from Rs 50 USD to Rs 60 USD India s GDP in USD during the period 2012 2013 increased by 5 decreased by 13 decreased by 20 decreased by 11 ,Percentage
 In a process the number of cycles to failure decreases exponentially with an increase in load At a load of 80 units it takes 100 cycles for failure When the load is halved it takes 10000 ext cycles for failure The load for which the failure will happen in 5000 ext cycles is _____________ 40 00 46 02 60 01 92 02  ,Proportions
The set of values of p for which the roots of the equation 3x 2 2x p p u20131 0 are of opposite sign is A u2013 u221e 0 B 0 1 C 1 u221e D 0 u221e ,Quadratic Equations
The roots of  ax2 bx c 0  are real and positive  a  b  and  c  are real Then  ax2 b x c 0  has  no roots 2 real roots 3 real roots 4 real roots ,Quadratic Equations
In a quadratic function the value of the product of the roots alpha  beta is 4 Find the value of             dfrac alpha n beta n alpha n beta n n 4 4 n 2 2n 1 4 n 1 ,Quadratic Equations
Based on the given statements select the most appropriate option to solve the given question If two floors in a certain building are 9 feet apart how many steps are there in a set of stairs that extends from the first floor to the second floor of the building Statements I Each step is 3 4 foot high II Each step is 1 foot wide  Statements I alone is sufficient but statement II alone is not sufficient Statements II alone is sufficient but statement I alone is not sufficient Both statements together are sufficient but neither statement alone is sufficient Statements I and II together are not sufficient  ,Statement Sufficiency
A transporter receives the same number of orders each day Currently he has some pending orders backlog to be shipped If he uses 7 trucks then at the end of the 4th day he can clear all the orders Alternatively if he uses only 3 trucks then all the orders are cleared at the end of the 10th day What is the minimum number of trucks required so that there will be no pending order at the end of 5th day A  4 B  5 C  6 D  7,Work Time
  Choose the grammatically CORRECT sentence He laid in bed till 8 o u2019clock in the morning He layed in bed till 8 o u2019clock in the morning He lain in bed till 8 o u2019clock in the morning He lay in bed till 8 o u2019clock in the morning ,English Grammar
 Which one of the parts A B C D in the sentence contains an ERROR No sooner had the doctor seen the results of the blood test than he suggested the patient to  see the specialist A no sooner had B results of the blood test C suggested the patient D see the specialist  ,English Grammar
Didn t you buy ____ when you went shopping any paper much paper no paper a few paper ,English Grammar
Out of the following 4 sentences select the most suitable sentence with respect to grammar and usage  Since the report lacked needed information it was of no use to them The report was useless to them because there were no needed information in it Since the report did not contain the needed information it was not real useful to them Since the report lacked needed information it would not had been useful to them ,English Grammar
The Tamil version of __________ John Abraham starrer  Madras Cafe  __________ cleared by the Censor Board with no cuts last week but the film s distributor _______ no takers among the exhibitors for a release in Tamilnadu _______ this Friday  Mr was found on a was found at the was found on a being find at ,English Grammar
 Out of the following four sentences select the most suitable sentence with respect to grammar and usage I will not leave the place until the minister does not meet me I will not leave the place until the minister doesn t meet me I will not leave the place until the minister meet me I will not leave the place until the minister meets me ,English Grammar
Archimedes said Give me a lever long enough and a fulcrum on which to place it and I will move the world The sentence above is an example of a ____________ statement figurative collateral literal figurine  ,English Grammar
 The hold of the nationalist imagination on our colonial past is such that anything inadequately or improperly nationalist is just not history Which of the following statements best reflects the author s opinion Nationalists are highly imaginative History is viewed through the filter of nationalism Our colonial past never happened Nationalism has to be both adequately and properly imagined ,Passage Reading
After Rajendra Chola returned from his voyage to Indonesia he ________ to visit the temple in Thanjavur was wishing is wishing wished had wished ,Tenses
