Question, Tag
Given a language L define L i as follows L 0 varepsilon L i L i 1  bullet  L ext for all I gt 0 The order of a language L is defined as the smallest k such that L k L k 1 Consider the language L_1 over alphabet O accepted by the following automaton The order of L_1 is ____  ,
 Which of the following is are example s of stateful application layer protocol HTTP FTP TCP POP3  i and ii only ii and iii only ii and iv only iv only ,Application Layer Protocols
Consider the three commands PROMPT HEAD and RCPT Which of the following options indicate a correct association of these commands with protocols where these are used HTTP SMTP FTP FTP HTTP SMTP HTTP FTP SMTP SMTP HTTP FTP ,Application Layer Protocols
HELO and PORT respectively are commands from the protocols FTP and HTTP TELNET and POP3 HTTP and TELNET SMTP and FTP ,Application Layer Protocols
Which one of the following uses UDP as the transport protocol HTTP Telnet DNS SMTP ,Application Layer Protocols
What is the maximum size of data that the application layer can pass on to the TCP layer below Any size 2 16 bytes size of TCP header 2 16 bytes 1500 bytes ,Application Layer Protocols
Provide the best matching between the entries in the two columns given in the table below I Proxy Server a Firewall II Kazaa DC b Caching III Slip c P2P IV DNS d PPP I a II d III c IV b I b II d III c IV a I a II c III d IV b I b II c III d IV a ,Application Layer Protocols
 Consider the different activities related to email m1 Send an email from mail client to mail server m2 Download an email from mailbox server to a mail client m3 Checking email in a web browser Which is the application level protocol used in each activity m1 HTTP  m2 SMTP  m3 POP m1  SMTP  m2 FTP  m3 HTTP m1  SMTP  m2 POP  m3 HTTP m1 POP  m2 SMTP  m3 IMAP ,Application Layer Protocols
A bit stuffing based framing protocol uses an ext 8 bit delimiter pattern of 01111110 If the output bit string after stuffing is 01111100101 then the input bit string is 0111110100 0111110101 0111111101 0111111111 ,Bit Stuffing
Consider the diagram shown below where a number of LANs are connected by  transparent bridges In order to avoid packets looping through circuits in the graph  the bridges organize themselves in a spanning tree First the root bridge is identified as  the bridge with the least serial number Next the root sends out one or more data  units to enable the setting up of the spanning tree of shortest paths from the root bridge  to each bridge  Each bridge identifies a port the root port through which it will forward frames to the  root bridge Port conflicts are always resolved in favour of the port with the lower index  value When there is a possibility of multiple bridges forwarding to the same LAN but  not through the root port ties are broken as follows bridges closest to the root get  preference and between such bridges the one with the lowest serial number is  preferred For the given connection of LANs by bridges which one of the following choices  represents the depth first traversal of the spanning tree of bridges B1 B5 B3 B4 B2 B1 B3 B5 B2 B4 B1 B5 B2 B3 B4 B1 B3 B4 B5 B2 ,Bridges
Consider the diagram shown below where a number of LANs are connected by  transparent bridges In order to avoid packets looping through circuits in the graph  the bridges organize themselves in a spanning tree First the root bridge is identified as  the bridge with the least serial number Next the root sends out one or more data  units to enable the setting up of the spanning tree of shortest paths from the root bridge  to each bridge  Each bridge identifies a port the root port through which it will forward frames to the  root bridge Port conflicts are always resolved in favour of the port with the lower index  value When there is a possibility of multiple bridges forwarding to the same LAN but  not through the root port ties are broken as follows bridges closest to the root get  preference and between such bridges the one with the lowest serial number is  preferred Consider the spanning tree B1 B5 B3 B4 B2 for the given connection of LANs by bridges that  represents the depth first traversal of the spanning tree of bridges  Let host H1 send  out a broadcast ping packet Which of the following options represents the  correct forwarding table on B3 ,Bridges
Assume that each character code consists of 8 bits The number of characters that can be transmitted per second through an asynchronous serial line at 2400 baud rate and with two stop bits is 109 216 218 219  ,Communication
In serial data transmission every byte of data is padded with a 0 in the beginning and one or two 1 s at the end of byte because receiver is to be synchronized for byte reception receiver recovers lost 0 s and 1 s from these padded bits padded bits are useful in parity computation none of the above ,Communication
How many 8 bit characters can be transmitted per second over a 9600 baud serial communication link using asynchronous mode of transmission with one start bit eight data bits two stop bits and one parity bit 600 800 876 1200 ,Communication
A serial transmission T1 uses 8 information bits 2 start bits 1 stop bit and 1 parity bit for each character A synchronous transmission T2 uses 3 eight bit sync characters followed by 30 eight bit information characters If the bit rate is 1200 bits second in both cases what are the transfer rates of  T1 and T2 100 characters sec 153 characters sec 80 characters sec 136 characters sec 100 characters sec 136 characters sec 80 characters sec 153 characters sec ,Communication
Let us consider a statistical time division multiplexing of packets The number of sources is 10 In a time unit a source transmits a packet of 1000 bits The number of sources sending data for the first 20 time units is 6 9 3 7 2 2 2 3 4 6 1 10 7 5 8 3 6 2 9 5 respectively The output capacity of multiplexer is 5000 bits per time unit Then the average number of backlogged of packets per time unit during the given period is 5 4 45 3 45 0 ,Communication
A broadcast channel has 10 nodes and total capacity of 10 Mbps It uses polling for medium access Once a node finishes transmission there is a polling delay of 80 u03bcs to poll the next node Whenever a node is polled it is allowed to transmit a maximum of 1000 bytes The maximum throughput of the broadcast channel is 1 Mbps 100 11 Mbps 10 Mbps 100 Mbps ,Communication
 Consider a source computer S transmitting a file of size 10 6 bits to a destination computer D over a network of two routers R_ 1 ext and R_ 2 and three links L_ 1 L_ 2 ext and L_ 3 L_ 1 connects S to R_ 1 L_ 2 connects R_ 1 to R_ 2 and L_ 3 connects R_ 2 to D Let each link be of length 100 km Assume signals travel over each link at a speed of 10 8 meters per second Assume that the link bandwidth on each link is 1 Mbps Let the file be broken down into 1000 packets each of size 1000 bits Find the total sum of transmission and propagation delays in transmitting the file from S to D A 1005 ms B 1010 ms C 3000 ms D 3003 ms ,Communication
On a TCP connection current congestion window size is Congestion Window 4 KB The window size advertised by the receiver is Advertise Window 6 KB The last byte sent by the sender is LastByteSent 10240 and the last byte acknowledged by the receiver is LastByteAcked 8192 The current window size at the sender is 2048 bytes 4096 bytes 6144 bytes 8192 bytes ,Congestion Control
In the slow start phase of the TCP congestion algorithm the size of the congestion window does not increase increase linearly increases quadratically increases exponentially ,Congestion Control
 Consider an instance of TCP rsquo s Additive Increase Multiplicative Decrease AIMD algorithm where the window size at the start of the slow start phase is 2 MSS and the threshold at the start of the first transmission is 8 MSS Assume that a timeout occurs during the fifth transmission Find the congestion window size at the end of the tenth transmission A 8 MSS B 14 MSS C 7 MSS D 12 MSS ,Congestion Control
Let the size of congestion window of a TCP connection be 32 KB when a timeout occurs The round trip time of the connection is 100 msec and the maximum segment size used is 2 KB The time taken  in msec  by the TCP connection to get back to 32 KB congestion window is _________ ,Congestion Control
Consider a simple communication system where multiple nodes are connected by a shared broadcast medium like Ethernet or wireless The nodes in the system use the following carrier sense the medium access protocol A node that receives a packet to transmit will carrier sense the medium for 5 units of time If the node does not detect any other transmission it waits until this other transmission finishes and then begins to carrier sense for 5 time units again Once they start to transmit nodes do not perform any collision detection and continue transmission even if a collision occurs All transmissions last for 20 units of time Assume that the transmission signal travels at the speed of 10 meters per unit time in the medium Assume that the system has two nodes P and Q located at a distance d meters from each other P starts transmitting a packet at time t 0 after successfully completing its carrier sense phase Node Q has a packet to transmit at time t 0 and begins to carrier sense the medium The maximum distance d in meters rounded to the closest integer that allows Q to successfully avoid a collision between its proposed transmission and P u2019s on going transmission is _______,Congestion Control
Consider the following message M 1010001101 The cyclic redundancy check CRC for this message using the divisor polynomial x5 x4 x2 1 is 01110 01011 10101 10110 ,Crc Polynomial
 The message 11001001 is to be transmitted using the CRC polynomial x 3 1 to protect it from errors The message that should be transmitted is  11001001000 11001001011 11001010 110010010011  ,Crc Polynomial
A computer network uses polynomials over GF 2 for error checking with 8 bits as information bits and uses x 3 x 1 as the generator polynomial to generate the check bits In this network the message 01011011 is transmitted as 01011011010 01011011011 01011011101 01011011100 ,Crc Polynomial
Anarkali digitally signs a message and sends it to Salim Verification of the signature by Salim requires Anarkali s public key Salim s public key Salim s private key Anarkali s private key  ,Cryptography
A sender S sends a message m to receiver R which is digitally signed by S with its private key In this scenario one or more of the following security violations can take place S can launch a birthday attack to replace m with a fraudulent message A third party attacker can launch a birthday attack to replace m with a fraudulent message R can launch a birthday attack to replace m with a fraudulent message Which of the following are possible security violations I and II only I only II only II and III only ,Cryptography
Which of the following statements is TRUE about CSMA CD IEEE 802 11 wireless LAN runs CSMA CD protocol Ethernet is not based on CSMA CD protocol CSMA CD is not suitable for a high propagation delay network like satellite network There is no contention in a CSMA CD network ,Csma Cd
A network with CSMA CD protocol in the MAC layer is running at 1 Gbps over a 1 km cable with no repeaters The signal speed in the cable is 2 x 108 m sec The minimum frame size for this network should be 10000 bits 10000 bytes 5000 bits 5000 bytes ,Csma Cd
The minimum frame size required for a CSMA CD based computer network running at 1 Gbps on a 200m cable with a link speed of 2 u00d7 108m s is 125 bytes 250 bytes 500 bytes None of the above ,Csma Cd
Consider a CDMA CD network that transmits data at a rate of 100 Mbps 10 8 bits per second over a 1 km kilometre cable with no repeaters If the minimum frame size required for this network is 1250 bytes What is the signal speed km sec in the cable 8000 10000 16000 20000 ,Csma Cd
A network has a data transmission bandwidth of 20 imes 10 6 bits per second It uses CSMA CD in the MAC layer The maximum signal propagation time from one node to another node is 40 microseconds The minimum size of a frame in the network is __________ bytes ,Csma Cd
Count to infinity is a problem associated with link state routing protocol distance vector routing protocol DNS while resolving host name TCP for congestion control ,Distance Vector Routing
For the network given in the figure below the routing tables of the four nodes A E D and G are shown Suppose that F has estimated its delay to its neighbors A E D and G as 8 10 12 and 6 msecs respectively and updates its routing table using distance vector routing technique          A 8  B  20  C  17  D  12  E  10  F  0  G  6  A  21  B  8  C  7  D  19  E  14  F  0  G  22  A  8  B  20  C  17  D  12  E  10  F  16  G  6  A  8  B  8  C  7  D  12  E  10  F  0  G  6 ,Distance Vector Routing
 Consider a network with 6 routers R1 to R6 connected with links having weights as shown in the following diagram All the routers use the distance vector based routing algorithm to update their routing tables Each router starts with its routing table initialized to contain an entry for each neighbour with the weight of the respective connecting link After all the routing tables stabilize how many links in the network will never be used for carrying any data 4 3 2 1 ,Distance Vector Routing
 Consider a network with 6 routers R1 to R6 connected with links having weights as shown in the following diagram Suppose the weights of all unused links are changed to 2 and the distance vector algorithm is used again until all routing tables stabilize How many links will now remain unused 0 1 2 3  ,Distance Vector Routing
 Consider a network with five nodes N1 to N5 as shown as below The network uses a Distance Vector Routing protocol Once the routes have been stabilized the distance vectors at different nodes are as following N1 0 1 7 8 4 N2 1 0 6 7 3 N3 7 6 0 2 6 N4 8 7 2 0 4 N5 4 3 6 4 0 Each distance vector is the distance of the best known path at that instance to nodes N1 to N5 where the distance to itself is 0 Also all links are symmetric and the cost is identical in both directions In each round all nodes exchange their distance vectors with their respective neighbors Then all nodes update their distance vectors In between two rounds any change in cost of a link will cause the two incident nodes to change only that entry in their distance vectors  The cost of link N2 N3 reduces to 2 in both directions After the next round of updates what will be the new distance vector at node N3 3 2 0 2 5 3 2 0 2 6 7 2 0 2 5 7 2 0 2 6 ,Distance Vector Routing
 Consider a network with five nodes N1 to N5 as shown as below The network uses a Distance Vector Routing protocol Once the routes have been stabilized the distance vectors at different nodes are as following N1 0 1 7 8 4 N2 1 0 6 7 3 N3 7 6 0 2 6 N4 8 7 2 0 4 N5 4 3 6 4 0 Each distance vector is the distance of the best known path at that instance to nodes N1 to N5 where the distance to itself is 0 Also all links are symmetric and the cost is identical in both directions In each round all nodes exchange their distance vectors with their respective neighbors Then all nodes update their distance vectors In between two rounds any change in cost of a link will cause the two incident nodes to change only that entry in their distance vectors The cost of link N2 N3 reduces to 2 in both directions After the next round of updates  the link N1 N2 goes down N2 will reflect this change immediately in its distance vector as cost infty After the  NEXT ROUND  of update what will be the cost to N1 in the distance vector of N3 3 9 10 infty ,Distance Vector Routing
Assume that host1 mydomain dom has an IP address of 145 128 16 8 Which of the following options would be most appropriate as a subsequence of steps in performing the reverse lookup of 145 128 16 8 In the following options NS is an abbreviation of nameserver Query a NS for the root domain and then NS for the dom domains Directly query a NS for dom and then a NS for mydomain dom domains Query a NS for in addr arpa and then a NS for 128 145 in addr arpa domains Directly query a NS for 145 in addr arpa and then a NS for 128 145 in addr arpa domains ,Dns
In the 4B 5B encoding scheme every 4 bits of data are encoded in a 5 bit codeword It is required that the codewords have at most 1 leading and at most 1 trailing zero How many such codewords are possible 14 16 18 20 ,Encoding
Consider a 3 bit error detection and 1 bit error correction hamming code for 4 bit data The extra parity bits required would be ___ and the 3 bit error detection is possible because the code has a minimum distance of ____,Error Detection
 What is the distance of the following code 000000 010101 000111 011001 111111 2 3 4 1  ,Error Detection
In a communication network a packet of length L bits takes link L_1 with a probability of p_1 or link L_2 with a probability of p_2 Link L_1 and L_2 have bit error probability of b_1 and b_2 respectively The probability that the packet will be received without error via either L_1 or L_2 is 1 b_1 Lp_1 1 b_2 Lp_2 1 b_1 b_2 L p_1p_2 1 b_1 L 1 b_2 Lp_1p_2 1 b_1 Lp_1 b_2 Lp_2 ,Error Detection
An error correcting code has the following code words 00000000 00001111 01010101 10101010 11110000 What is the maximum number of bit errors that can be corrected 0 1 2 3 ,Error Detection
Data transmitted on a link uses the following 2D parity scheme for error detection Each sequence of 28 bits is arranged in a 4 imes 7 matrix rows r_0  through r_3 and columns d_7  through d_1 and is padded with a column d_0  and row r_4  of parity bits computed using the Even parity scheme Each bit of column d_0  respectively row r_4 gives the parity of the corresponding row respectively column These 40 bits are transmitted over the data link The table shows data received by a receiver and has n corrupted bits What is the mini u00admum possible value of n 1 2 3 4 ,Error Detection
Let G x be the generator polynomial used for CRC checking What is the condition that should be satisfied by G x to detect odd number of bits in error  G x contains more than two terms G x does not divide 1 x k for any k not exceeding the frame length 1 x is a factor of G x G x has an odd number of terms ,Error Detection
A and B are the only two stations on an Ethernet Each has a steady queue of frames to send Both A and B attempt to transmit a frame collide and A wins the first backoff race At the end of this successful transmission by A both A and B attempt to transmit and collide The probability that A wins the second backoff race is 0 5 0 625 0 75 1 0 ,Ethernet
Which of the following statements is TRUE Both Ethernet frame and IP packet include checksum fields Ethernet frame includes a checksum field and IP packet includes a CRC field Ethernet frame includes a CRC field and IP packet includes a checksum field Both Ethernet frame and IP packet include CRC fields ,Ethernet
Determine the maximum length of the cable in km for transmitting data at a rate of 500 Mbps in an Ethernet LAN with frames of size 10 000 bits Assume the signal speed in the cable to be 2 00 000 km s 1 2     2 5    5 ,Ethernet
In an Ethernet local area network which one of the following statements is TRUE A station stops to sense the channel once it starts transmitting a frame The purpose of the jamming signal is to pad the frames that are smaller than the minimum frame size A station continues to transmit the packet even after the collision is detected The exponential back off mechanism reduces the probability of collision on retransmissions   ,Ethernet
A layer 4 firewall a device that can look at all protocol headers up to theransport layer  CANNOT block entire ext HTTP traffic during  9 00PM and 5 00AM block all ext ICMP traffic stop incoming traffic from specific ext IP address but allow outgoing traffic to the same IP address block ext TCP traffic from a specific user on a multi user system during 9 00PM to 5 00AM ,Firewall
Following 7 bit single error correcting hamming coded message is received Determine if the message is correct assuming that at most 1 bit could be corrupted If the message contains an error find the bit which is erroneous and gives correct message ,Hamming Code
Consider the binary code that consists of only four valid codewords as given below 00000 01011 10101 11110 Let the minimum Hamming distance of the code p and the maximum number of erroneous bits that can be corrected by the code be q Then the values of p and q are p 3 and q 1 p 3 and q 2 p 4 and q 1 p 4 and q 2  ,Hamming Code
Traceroute reports a possible route that is taken by packets moving from some host A o some other host  B Which of the following options represents the technique used byraceroute to identify these hosts By progressively querying routers about the next router on the path to B using ext ICMP packets starting with the first router By requiring each router to append the address to the ext ICMP packet as it is forwarded to B The list of all routers en route to B is returned by B in an ext ICMP reply packet By ensuring that an ext ICMP reply packet is returned to A by each router en route to B in the ascending order of their hop distance from A By locally computing the shortest path from A to B ,Icmp
An IP datagram of size 1000 bytes arrives at a router The router has to forward this packet on a link whose MTU maximum transmission unit is 100 bytes Assume that the size of the IP header is 20 bytes The number of fragments that the IP datagram will be divided into for transmission is________ ,Ip Packet
In the TCP IP protocol suite which one of the following is NOT part of the IP header Fragment Offset Source IP address Destination IP address Destination port number ,Ip Packet
For which one of the following reasons does internet protocol IP use the time to live TTL field in IP datagram header Ensure packets reach destination within that time Discard packets that reach later than that time Prevent packets from looping indefinitely Limit the time for which a packet gets queued in intermediate routers ,Ip Packet
One of the header fields in an IP datagram is the Time to Live TTL field Which of the following statements best explains the need for this field It can be used to prioritize packets It can be used to reduce delays It can be used to optimize throughput It can be used to prevent packet looping ,Ip Packet
Host A on TCP IP v4 network A sends an IP datagram D to host B also on TCP IP v4 network B Assume that no error occurred during the transmission of D When D reaches B which of the following IP header field s may be different from that of the original datagram D TTL Checksum Fragment Offset i only i and ii only ii and iii only i ii  and iii ,Ip Packet
An IP router with a ext Maximum Transmission Unit MTU of 1500 bytes has received an IP packet of size 4404 ext bytes with an IP header of length 20 ext bytes The values of the relevant fields in the header of the third IP fragment generated by the router for this packet are MF bit 0  Datagram Length 1444 Offset 370 MF bit 1  Datagram Length 1424 Offset 185 MF bit 1  Datagram Length 1500 Offset 370 MF bit 0  Datagram Length 1424 Offset 2960 ,Ip Packet
 Which of the following fields of an IP header is NOT modified by a typical IP router Check sum Source address Time to Live TTL Length ,Ip Packet
Which of the following assertions is FALSE about the Internet Protocol IP It is possible for a computer to have multiple IP addresses IP packets from the same source to the same destination can take different routes in the network IP ensures that a packet is discarded if it is unable to reach its destination within a given number of hops The packet source cannot set the route of an outgoing packets the route is determined only by the routing tables in the routers on the way ,Ipv4
Consider three IP networks A B and C Host H_A in network  A sends messages each containing 180 bytes of application data to a host H_C in network C The ext TCP layer prefixes 20 byte header to the message This passes through an intermediate network B The maximum packet size  including 20 byte IP header in each network is A ext 1000 bytes B ext 100 bytes C ext 1000 bytes The network A and B are connected through a 1 Mbps link while B and C  are connected by a 512  Kbps link bps bits per second      Assuming that the packets are correctly delivered how many bytes including headers are delivered to the IP layer at the destination for one application message  in the best case Consider only data packets 200 220 240 260 ,Ipv4
Consider three IP networks A B and C Host H_A in network  A sends messages each containing 180 bytes of application data to a host H_C in network C The TCP layer prefixes 20 byte header to the message This passes through an intermediate network B The maximum packet size including 20 byte IP header in each network is A 1000 bytes B 100 bytes C 1000 bytes The network A and B are connected through a 1 Mbps link while B and C are connected by a 512 Kbps link bps bits per second What is the rate at which application data is transferred to host H_C Ignore errors acknowledgements and other overheads 325 5 Kbps 354 5 Kbps 409 6 Kbps 512 0 Kbps ,Ipv4
In the IPv4 addressing format the number of networks allowed under Class C addresses is A 2 14 B 2 7 C 2 21 D 2 24 ,Ipv4
In an IPv4 datagram the M bit is 0 the value of HLEN is 10 the value of total length is 400 and the fragment offset value is 300 The position of the datagram the sequence numbers of the first and the last bytes of the payload respectively are A Last fragment 2400 and 2789 B First fragment 2400 and 2759 C Last fragment 2400 and 2759 D Middle fragment 300 and 689,Ipv4
