Question, Tag
Let A be array of n integers sorted so that A 1 leq A 2 leq dots A n Suppose you are given a number x and you wish to find out if there exist indices k l such that A k A l x Design an O n algorithm for this problem ,Algorithm Design
An element in an array X is called a leader if it is greater than all elements to the   right of it in X The best algorithm to find all leaders in an array  Solves it in linear time using a left to right pass of the array Solves it in linear time using a right to left pass of the array Solves it using divide and conquer in time Theta n log n Solves it in time Theta n 2 ,Algorithm Design
Given two arrays of numbers a_ 1 a_ n and b_ 1 b_ n where each number is 0 or 1 the fastest algorithm to find the largest span i j such that a_ i a_ i 1 dots a_ j b_ i b_ i 1 dots b_ j or report that there is not such span Takes  0 3 n and Omega 2 n time if hashing is permitted Takes 0 n 3 and Omega n 2 5 time in the key comparison mode Takes Theta n time and space Takes O sqrt n time only if the sum of the 2n elements is an even number ,Algorithm Design
You are given ten rings numbered from 1 to 10 and three pegs labeled A B and C Initially all the rings are on peg A arranged from top to bottom in ascending order of their numbers The goal is to move all the rings to peg B in the minimum number of moves obeying the following constraints In one move only one ring can be moved A ring can only be moved from the top of its peg to the top of a new peg At no point can a ring be placed on top of another ring with a lower number How many moves are required 501 1023 2011 10079 None of the above ,Algorithm Design
The correct matching for the following pairs is A All pairs shortest path 1 Greedy B Quick Sort 2 Depth First search C Minimum weight spanning tree 3 Dynamic Programming D Connected Components 4 Divide and and Conquer A 2 B 4 C 1 D 3 A 3 B 4 C 1 D 2 A 3 B 4 C 2 D 1 A 4 B 1 C 2 D 3 ,Algorithm Design Techniques
Match the following P Prim s algorithm for minimum spanning tree   i  Backtracking Q Floyd Warshall algorithm for all pairs shortest paths  ii  Greedy method R Mergesort      iii Dynamic programming S Hamiltonian circuit   iv  Divide and conquer                   P iii Q ii R iv S i P i Q ii R iv S iii P ii Q iii R iv S i P ii Q i R iii S iv ,Algorithm Design Techniques
Given below are some algorithms and some algorithm design paradigms 1 Dijkstra s Shortest Path i Divide and Conquer 2 Floyd Warshall algorithm to compute all pairs shortest path ii Dynamic Programming 3 Binary search on a sorted array iii Greedy design 4 Backtracking search on a graph iv Depth first search  v Breadth first search Match the above algorithms on the left to the corresponding design paradigm they follow 1 i 2 iii 3 i 4 v 1 iii 2 iii 3 i 4 v 1 iii 2 ii 3 i 4 iv 1 iii 2 ii 3 i 4 v ,Algorithm Design Techniques
Consider the following table Algorithms Design Paradigms P Kruskal i Divide and Conquer Q Quicksort ii Greedy R Floyd Warshall iii Dynamic Programming Match the algorithms to the design paradigms they are based on P  leftrightarrow ii Q  leftrightarrow iii R  leftrightarrow i P  leftrightarrow iii Q  leftrightarrow i R  leftrightarrow ii P  leftrightarrow ii Q  leftrightarrow i R  leftrightarrow iii P  leftrightarrow i Q  leftrightarrow ii R  leftrightarrow iii ,Algorithm Design Techniques
Consider the following two functions g_1 n begin cases n 3 ext for 0 leq n leq 10 000 n 2 ext for n geq 10 000 end cases g_2 n begin cases n ext for 0 leq n leq 100 n 3 ext for n gt 100 end cases Which of the following is true g_1 n ext is O g_2 n g_1 n ext is O n 3 g_2 n ext is O g_1 n g_2 n ext is O n  ,Asymptotic Notations
Which of the following is false 100n log n O frac n log n 100 sqrt log n O log log n If 0 lt x lt y ext then n x O left n y right 2 n eq O left nk right ,Asymptotic Notations
If T_1 O 1 give the correct matching for the following pairs M T_n T_ n 1 n U T_n O n N T_n T_ n 2 n V T_n O n log n O T_n T_ n 2 n log n W T O n 2 P T_n T_ n 1 log n X T_n O log 2 n M W N V O U P X M W N U O X P V M V N W O X P U M W N U O V P X ,Asymptotic Notations
Consider the following functions f n 3n sqrt n g n 2 sqrt n log_ 2 n h n n Which of the following is true h n is O f n h n is O g n g n is not O f n f n is O g n   ,Asymptotic Notations
Let f n n 2 log n and g n n log n 10 be two positive functions of n Which of the following statements is correct f n O g n ext and g n eq O f n g n O f n ext and f n eq O g n f n eq O g n ext and g n eq O f n f n O g n ext and g n O f n ,Asymptotic Notations
Consider the following three claims n k m Theta n m where k and m are constants 2 n 1 O 2 n 2 2n 1 O 2 n Which of the following claims are correct I and II I and III II and III I II and III ,Asymptotic Notations
Let f n g n and h n be functions defined for positive inter such that  f n O g n g n  eq  O f n g n O h n and h n O g n Which one of the following statements is FALSE f n g n O h n  h n f n O h n h n eq  O f n f n h n eq  O g n h n ,Asymptotic Notations
We are given a set of n distinct elements and an unlabeled binary tree with n nodes In how many ways can we populate the tree with the given set so that it becomes a binary search tree 0 1 n frac 1 n 1 2n C_n ,Bst
The subset sum problem is defined as follows Given a set of n positive integers S a_1 a_2 a_3 dots a_n and positive integer W is there a subset of S whose elements sum to W A dynamic program for solving this problem uses a 2 dimensional Boolean array X with n rows and W 1 columns  X i j 1 leq i leq n 0 leq j leq  W is TRUE if and only if there is a subset of a_1 a_2 dots a_i whose elements sum to j Which  of the following is valid for 2 leq i leq n and a_i leq j leq W X i j X i 1 j vee X i j a_i X i j X i 1 j vee  X i 1 j a_i X i j X i 1 j wedge X i j a_i X i j X i 1 j wedge  X i 1 j a_i ,Dynamic Programming
The subset sum problem is defined as follows Given a set of n positive integers S a_1 a_2 a_3 dots a_n and positive integer W is there a subset of S whose elements sum to W A dynamic program for solving this problem uses a 2 dimensional Boolean array X with n rows and W 1 columns X i j 1 leq i leq n 0 leq j leq W is TRUE if and only if there is a subset of a_1 a_2 dots a_i whose elements sum to j Which entry of the array X if TRUE implies that there is a subset whose elements sum to W X 1 W X n 0 X n W X n 1 n ,Dynamic Programming
A sub sequence of a given sequence is just the given sequence with some elements possibly none or all left out We are given two sequences X m and Y n of lengths m and n respectively with indexes of X and Y starting from 0 We wish to find the length of the longest common sub sequence LCS of X m and Y n as l m n where an incomplete recursive definition for the function I i j to compute the length of the LCS of X m and Y n is given below l i j 0 if either i 0 or j 0 expr1 if i j gt 0 and X i 1 Y j 1 expr2 if i j gt 0 and X i 1 u2260 Y j 1 Which one of the following options is correct ext expr1 l left i 1 j right 1 ext expr1 l left i j 1 right ext expr2 max left l left i 1 j right l left i j 1 right right ext expr2 max left l left i 1 j 1 right l left i j right right ,Dynamic Programming
A sub sequence of a given sequence is just the given sequence with some elements possibly none or all left out We are given two sequences X m and Y n of lengths m and n respectively with indexes of X and Y starting from 0 We wish to find the length of the longest common sub sequence LCS of X m and Y n as l m n where an incomplete recursive definition for the function I i j to compute the length of the LCS of X m and Y n is given below l i j  0 if either i 0 or j 0     expr1 if i j gt 0 and X i 1 Y j 1     expr2 if i j gt 0 and X i 1 u2260 Y j 1 The value of l i j could be obtained by dynamic programming based on the correct recursive definition of l i j of the form given above using an array L M N where M m 1 and N n 1 such that L i j l i j Which one of the following statements would be TRUE regarding the dynamic programming solution for the recursive definition of l i j All elements of L should be initialized to 0 for the values of l i j to be properly computed The values of l i j may be computed in a row major order or column major order of L M N The values of l i j cannot be computed in either row major order or column major order of L M N L p q needs to be computed before L r s if either p lt r or q lt s ,Dynamic Programming
The weight of a sequence a_0 a_1 dots a_ n 1 of real numbers is defined as a_0 a_1 2 dots a_ n 1 2 n 1 A subsequence of a sequence is obtained by deleting some elements from the sequence keeping the order of the remaining elements the same Let X denote the maximum possible weight of a subsequence of a_o a_1 dots a_ n 1 and Y the maximum possible weight of a subsequence of a_1 a_2 dots a_ n 1 Then X is equal to max Y a_0 Y max Y a_0 Y 2 max Y a_0 2Y a_0 Y 2 ,Dynamic Programming
An algorithm to find the length of the longest monotonically increasing sequence of numbers in an array A 0 n 1 is given below Let L_i denote the length of the longest monotonically increasing sequence starting at index i in the array Initialize L_ n 1 1 For all i such that 0 leq i leq n 2 L_i begin cases 1 L_ i 1 amp  quad ext if A i lt A i 1 1 amp quad ext Otherwise end cases Finally the the length of the longest monotonically increasing sequence is ext Max L_0 L_1 dots L_ n 1 Which of the following statements is  TRUE The algorithm uses dynamic programming paradigm The algorithm has a linear complexity and uses branch and bound paradigm The algorithm has a non linear polynomial complexity and uses branch and bound paradigm The algorithm uses divide and conquer paradigm ,Dynamic Programming
Four Matrices M_1 M_2 M_3 and M_4 of dimensions p imes q q imes r r imes s and s imes t respectively can be multiplied in several ways with different number of total scalar multiplications For example when multiplied as M_1 imes M_2 imes M_3 imes M_4 the total number of scalar multiplications is pqr rst prt When multiplied as M_1 imes M_2 imes M_3 imes M_4 the total number of scalar multiplications is pqr prs pst If p 10 q 100 r 20 s 5 and t 80 then the minimum number of scalar multiplications needed is  248000  44000  19000  25000 ,Dynamic Programming
Consider the following directed graph   The number of different topological orderings of the vertices of the graph is _____________ ,Graph Algorithms
Which of the following statements is false Optimal binary search tree construction can be performed efficiently using dynamic programming Breadth first search cannot be used to find connected components of a graph Given the prefix and postfix walks over a binary tree the binary tree cannot be uniquely constructed Depth first search can be used to find connected components of a graph ,Graph Algorithms
An independent set in a graph is a subset of vertices such that no two vertices in the subset are connected by an edge An incomplete scheme for a greedy algorithm to find a maximum independent set in a tree is given below V Set of all vertices in the tree I u03d5 while V u2260 u03d5 do begin select a vertex u u220a V such that _______ V V u if u is such that ________then I I u222a u end Output I Complete the algorithm by specifying the property of vertex u in each case What is the time complexity of the algorithm  ,Graph Algorithms
Let G be the directed weighted graph shown in below figure We are interested in the shortest paths from A Output the sequence of vertices identified by the Dijkstra u2019s algorithm for single source shortest path when the algorithm is started at node A Write down sequence of vertices in the shortest path from A to E What is the cost of the shortest path from A to E  ,Graph Algorithms
 Which one of the following algorithm design techniques is used in finding all pairs of shortest distances in a graph Dynamic programming Backtracking Greedy Divide and Conquer  ,Graph Algorithms
The most appropriate matching for the following pairs X depth first search 1 heap Y breadth first search 2 queue Z sorting 3 stack is X 1  Y 2  Z 3 X 3  Y 1  Z 2 X 3  Y 2  Z 1 X 2  Y 3  Z 1 ,Graph Algorithms
Consider an undirected unweighted graph G Let a breadth first traversal of G be done starting from a node r Let d r u and d r v be the lengths of the shortest paths from r to u and v respectively in G if u visited before v during the breadth first traversal which of the following statements is correct d r u lt d r v d r u gt d r v d r u leq d r v None of the above ,Graph Algorithms
You are given n positive integers d_1 d_2 dots d_n each greater than 0 Design a greedy algorithm to test whether these integers correspond to the degrees of some n vertex simple undirected graph G V E A simple graph has no self loops and at most one edge between any pair of vertices ,Greedy Algorithm
The minimum number of record movements required to merge five files A with 10 records B with 20 records C with 15 records D with 5 records and E with 25 records is 165 90 75 65 ,Greedy Algorithm
The following are the starting and ending times of activities A B C D E F G and H respectively in chronological order u201ca_s  b_s c_s a_e d_s c_e e_s f_s b_e d_e g_s e_e f_e h_s g_e h_e u201d Here x_s denotes  the starting time and x_e denotes the ending time of activity X We need to schedule the activities in a set of rooms available to  us An activity can be scheduled in a room only if the room is reserved for the activity for its entire duration What is the minimum number of rooms required 3 4 5 6 ,Greedy Algorithm
We are given 9 tasks T_1 T_2 dots T_9 The execution of each task requires one unit of time We can execute one task at a time Each task T_i has a profit P_i and a deadline d_i Profit P_i is earned if the task is completed before the end of the d_i th unit of time Task T_1 T_2 T_3 T_4 T_5 T_6 T_7 T_8 T_9 Profit 15 20 30 18 18 10 23 16 25 Deadline 7 2 5 3 4 5 2 7 3 Are all tasks completed in the schedule that gives maximum profit All tasks are completed T_1 and T_6 are left out T_1 and T_8 are left out T_4 and T_6 are left out ,Greedy Algorithm
We are given 9 tasks T_1 T_2 dots T_9 The execution of each task requires one unit of time We can execute one task at a time Each task T_i has a profit P_i and a deadline d_i Profit P_i is earned if the task is completed before the end of the d_i th unit of time Task T_1 T_2 T_3 T_4 T_5 T_6 T_7 T_8 T_9 Profit 15 20 30 18 18 10 23 16 25 Deadline 7 2 5 3 4 5 2 7 3 What is the maximum profit earned 147 165 167 175 ,Greedy Algorithm
The characters a to h have the set of frequencies based on the first 8 Fibonacci numbers as follows a 1 b 1 c 2 d 3 e 5 f 8 g 13 h 21 A Huffman code is used to represent the characters What is the sequence of characters corresponding to the following code 110111100111010 fdheg ecgdf dchfg fehdg ,Greedy Algorithm
Suppose the letters a b c d e f have probabilities frac 1 2 frac 1 4 frac 1 8 frac 1 16 frac 1 32 frac 1 32 respectively  Which of the following is the Huffman code for the letter a b c d e f 0 10 110 1110 11110 11111 11 10 011 010 001 000 11 10 01 001 0001 0000 110 100 010 000 001 111 ,Greedy Algorithm
A message is made up  entirely of characters from the set X P Q R S T The table of probabilities for each of the characters is shown below Character Probability P 0 22 Q 0 34 R 0 17 S 0 19 T 0 08 Total 1 00 If a message of 100 characters over X is encoded using Huffman coding then the expected length of the encoded message in bits is ______  ,Huffman Code
Choose the correct alternatives more than one may be correct and write the corresponding letters only Consider the following Pascal function Function X M integer integer Var i integer Begin i 0 while i i lt M do i i 1 X i end The function call X N if N is positive will return lfloor sqrt N rfloor lfloor sqrt N rfloor 1 lceil sqrt N rceil lceil sqrt N rceil 1 None of the above ,Identify Function
What function of x n is computed by this program Function what x n integer integer Var value integer begin value 1 if n gt 0 then begin if n mod 2 1 then value value x value value what x x n div 2 end what value end  ,Identify Function
In the following Pascal program segment what is the value of X after the execution of the program segment X 10 Y 20 If X gt Y then if X lt 0 then X abs X else X 2 X 10 20 10 None  ,Identify Function
What value would the following function return for the input x 95 Function fun x integer integer Begin If x gt 100 then fun x u2013 10 Else fun fun fun x 11 End 89 90 91 92   ,Identify Function
Consider the following C function definition int Trial int a int b int c if a gt b amp amp c lt b return b else if a gt b return Trial a c b else return Trial b a c The functional Trial Finds the maximum of a b and c Finds the minimum of a b and c Finds the middle number of a b c None of the above  ,Identify Function
Suppose you are given an array s 1 n and a procedure reverse s i j which reverses the order of elements in s  between positions i and j both inclusive What does the following sequence do where 1  leqslant  k  leqslant n reverse s 1 k reverse s k 1 n  reverse s 1 n Rotates s  left by k  positions Leaves s  unchanged  Reverses all elements of  s None of the above ,Identify Function
Consider the following C function For large values of y the return value of the function f best approximates float f float x int y float p s int i for s 1 p 1 i 1 i lt y i p x i s p return s x y e x ext ln 1 x x x ,Identify Function
The minimum number of comparisons required to find the minimum and the maximum of 100 numbers is ________,Minimum Maximum
Given a set of n distinct numbers we would like to determine both the smallest and the largest  number Which of the following statements is TRUE These two elements can be determined using O left log 100 n right  comparisons O left log 100 n right  comparisons do not suffice however these two elements can be determined using n  O log n comparisons n O log n comparisons do not suffice however these two elements can be determined using 3 lceil n 2 rceil  comparisons 3 lceil n 2 rceil  comparisons do not suffice however these two elements can be determined using 2 n 1 comparisons None of the above ,Minimum Maximum
Consider the problem of computing the minimum of a set of n distinct numbers We choose a  permutation uniformly at random i e each of the n permutations of left langle 1 n right rangle  is chosen with probability 1 n and we inspect the numbers in the order given by this permutation  We maintain a variable MIN that holds the minimum value seen so far MIN is initialized to infty  and if we see a value smaller than MIN during our inspection then MIN is updated For example in the inspection  given by the following sequence MIN is updated four times   5 9 4 2 6 8 0 3 1 7 What is the expected number of times MIN is updated O 1 H_ n sum n _ i 1 1 i sqrt n n 2 n ,Minimum Maximum
Given a set of n distinct numbers we would like to determine the smallest three numbers in this set  using comparisons Which of the following statements is TRUE These three elements can be determined using O left log 2 n right  comparisons O left log 2 n right comparisons do not suffice however these three elements can be determined using n O 1  comparisons n O 1 comparisons do not suffice however these three elements can be determined using n O log n comparisons n O log n comparisons do not suffice however these three elements can be determined using O n  comparisons None of the above ,Minimum Maximum
Ram and Shyam have been asked to show that a certain problem Pi is NP complete Ram shows a polynomial time reduction from the 3 SAT problem to Pi and Shyam shows a polynomial time reduction from Pi to 3 SAT Which of the following can be inferred from these reductions Pi is NP hard but not NP complete Pi is in NP but is not NP complete Pi is NP complete Pi is neither NP hard nor in NP ,Np Completeness
Let S be an NP complete problem and Q and R be two other problems not known to be in NP Q is polynomial time reducible to S and S is polynomial time reducible to R Which one of the following statements is true R is NP complete R is NP hard Q is NP complete Q is NP hard ,Np Completeness
The subset sum problem is defined as follows Given a set S of n positive integers and a positive integer W determine whether there is a subset of S whose elements sum to W An algorithm Q solves this problem in O nW time Which of the following statements is false Q solves the subset sum problem in polynomial time when the input is encoded in unary Q  solves the subset sum problem in polynomial time when the input is encoded in binary The subset sum  problem belongs to the class NP The subset sum problem is NP hard ,Np Completeness
Assuming P eq  NP which of the following is TRUE NP complete NP NP complete cap  P phi NP hard NP P NP complete ,Np Completeness
Which of the following statements are TRUE The problem of determining whether there exists a cycle in an undirected graph is in P The problem of determining whether there exists a cycle in an undirected graph is in NP If a problem A is NP Complete there exists a non deterministic polynomial time algorithm to solve A  1 2 and 3   1 and 2 only   2 and 3 only   1 and 3 only ,Np Completeness
There are 5 bags labeled 1 to 5 All the coins in a given bag have the same weight Some bags have coins of weight 10 gm others have coins of weight 11 gm I pick 1 2 4 8 16 coins respectively from bags 1 to 5 Their total weight comes out to 323 gm Then the product of the labels of the bags having 11 gm coins is ___ ,Numerical Computation
Consider the following game There is a list of distinct numbers At any round a player arbitrarily  chooses two numbers a b from the list and generates a new number c by subtracting the smaller number  from the larger one The numbers a and b are put back in the list If the number c is non zero and is not yet  in the list c is added to the list The player is allowed to play as many rounds as the player wants The score  of a player at the end is the size of the final list Suppose at the beginning of the game the list contains the following numbers 48 99 120 165 and 273  What is the score of the best player for this game 40 16 33 91 123 ,Numerical Computation
A container originally contains 10 litres of pure spirit From this container 1 litre of spirit replaced with 1 litre of water Subsequently 1 litre of the mixture is again replaced with 1 litre of water and this process is repeated one more time How much spirit is now left in the container 7 58 litres 7 84 litres 7 litres 7 29 litres ,Numerical Computation
If large left z dfrac 1 z right 2 98 compute large left z 2 dfrac 1 z 2 right ,Numerical Computation
A marine biologist wanted to estimate the number of fish in a large lake He threw a net and found 30 fish in the net He marked all these fish and released them into the lake The next morning he again threw the net and this time caught 40 fish of which two were found to be marked The approximate number of fish in the lake is 600 1200 68 800 120  ,Numerical Computation
Solve the recurrence equations T n T n 1 n T 1 1 ,Recurrence
Express T n in terms of the harmonic number H_ n sum_ t 1 n 1 i n geq 1 where T n satisfies the recurrence relation T n frac n 1 n T n 1 1 for n geq sum and T 1 1 What is the asymptotic behaviour of T n as a function of n ,Recurrence
Consider the function F n for which the pseudocode is given below Function F n begin F1 u2190 1 if n 1 then F u2190 3 else For i 1 to n do begin C u2190 0 For j 1 to n u2013 1 do begin C u2190 C 1 end F1 F1 C end F F1 end n is a positive integer greater than zero Solve the recurrence relation for a closed form solution of F n ,Recurrence
Consider the recursive algorithm given below procedure bubblesort n var i j index temp item begin for i 1 to n 1 do if A i gt A i 1 then begin temp A i A i A i 1 A i 1 temp end bubblesort n 1 end Let a_n be the number of times the u2018if u2026then u2026 u2019 statement gets executed when the algorithm is run with value n Set up the recurrence relation by defining a_n in terms of a_ n 1 Solve for a_n ,Recurrence
The recurrence relation that arises in relation with the complexity of binary search is T n 2T left frac n 2 right k ext k is a constant T n T left frac n 2 right k ext k is a constant T n T left frac n 2 right log n T n T left frac n 2 right n  ,Recurrence
The recurrence relation T 1 2 T n 3T frac n 4 n has the solution T n equal to O n O log n O left n frac 3 4 right  None of the above  ,Recurrence
Let T n be the function defined by T 1 1 T n 2T lfloor frac n 2 rfloor sqrt n for n geq 2 Which of the following statements is true T n O sqrt n T n O n T n O log n None of the above ,Recurrence
Consider the following program that attempts to locate an element x in an array a using binary search Assume N gt 1 The program is erroneous Under what conditions does the program fail var i j k integer x integer a array 1 N of integer begin i 1 j n repeat k i j div 2 if a k lt x then i k else j k until a k x or i gt j if a k x then writeln x is in the array else writeln x is not in the array end ,Searching
The average number of key comparisons required for a successful search for sequential search on n items is frac n 2 frac n 1 2 frac n 1 2 None of the above ,Searching
Consider the following algorithm for searching for a given number x in an unsorted array A 1 n having n distinct values Choose an i at random from 1 n If A i x then Stop else Goto 1 Assuming that x is present in A what is the expected number of comparisons made by the algorithm before it terminates n n 1 2n frac n 2 ,Searching
