Question, Tag
For x in 0 1 let lnot x denote the negation of x that is lnot  x begin cases 1 amp mbox iff x 0 0 amp mbox iff x 1 end cases If x in 0 1 n then lnot x denotes the component wise negation of x that is lnot x _i biggl lnot x_i mid i in 1 n biggr Consider a circuit C computing a function f 0 1 n o 0 1 using AND land OR lor and NOT lnot gates Let D be the circuit obtained from C by replacing each AND gate by an OR gate and replacing each OR gate by an AND Suppose D computes the function g Which of the following is true for all inputs x g x lnot f x g x f x land f lnot x g x f x lor f lnot x g x lnot f lnot x None of the above ,Boolean Algebra
 Consider the Boolean operator with the following properties x 0 x x 1 overline x x x 0 and x overline x 1 Then x y is equivalent to  x overline y overline x y x overline y overline x overline y overline x y xy xy overline x overline y ,Boolean Expressions
The Boolean expression A oplus B oplus A is equivalent to AB bar A bar B bar A B A bar B B bar A ,Boolean Expressions
Find values of Boolean variables A B C which satisfy the following equations A B 1 AC BC A C 1 AB 0 ,Boolean Expressions
 Let be a Boolean operation defined as A B AB overline A overline B If C A B then evaluate and fill in the blanks A A ____ C A ____ Solve the following boolean equations for the values of A B and C AB overline A C 1 AC B 0   ,Boolean Expressions
What values of A B C and D satisfy the following simultaneous Boolean equations overline A AB 0 AB AC AB A overline C CD overline C D A 1 B 0 C 0 D 1 A 1 B 1 C 0 D 0 A 1 B 0 C 1 D 1 A 1 B 0 C 0 D 0 ,Boolean Expressions
Let be defined as x y bar x y Let z x y Value of z x is  bar x y x 0 1  ,Boolean Expressions
Let f A B A B Simplified expression for function f f x y y z is x z xyz xy z None of the above ,Boolean Expressions
Choose the correct alternatives more than one may be correct and write the corresponding letters only The operation which is commutative but not associative is AND OR EX OR NAND  ,Boolean Operations
Which of the following operations is commutative but not associative AND OR NAND EXOR  ,Boolean Operations
Which of the following expressions is not equivalent to bar x x ext NAND x x ext NOR x x ext NAND 1 x ext NOR 1  ,Boolean Operations
When multiplicand Y is multiplied by multiplier X x_ n 1 x_ n 2 dots x_0 using bit pair recoding in Booth s algorithm partial products are generated according to the following table Row xi 1 xi xi 1 Partial Product 1 0 0 0 0 2 0 0 1 Y 3 0 1 0 Y 4 0 1 1 2Y 5 1 0 0 6 1 0 1 Y 7 1 1 0 Y 8 1 1 1 The partial products for rows 5 and 8 are 2Y and Y 2Y and 2Y 2Y and 0 0 and Y ,Booth Recoding
Booth u2019s algorithm for integer multiplication gives worst performance when the multiplier pattern is 101010 u2026 1010 100000 u2026 0001 111111 u2026 1111 011111 u2026 1110  ,Booths Algorithm
Booth s coding in 8 bits for the decimal number 57 is 0 100 1000 0 100 100 1 0 1 100 10 1 00 10 100 1  ,Booths Algorithm
Using Booth s Algorithm for multiplication the multiplier 57 will be recoded as 0 1 0 0 1 0 0 1 1 1 0 0 0 1 1 1 0 1 0 0 1 0 0 0 0 1 0 0 1 0 0 1 ,Booths Algorithm
The two numbers given below are multiplied using the Booth s algorithm Multiplicand                             0101 1010 1110 1110 Multiplier                            0111 0111 1011 1101 How many additions Subtractions are required for the multiplication of the above two numbers 6 8 10 12 ,Booths Algorithm
Find the minimum product of sums of the following expression f ABC bar A bar B bar C ,Canonical Normal Form
Consider the following logic circuit whose inputs are functions f_1 f_2 f_3 and output is f Given that f_1 x y z Sigma 0 1 3 5 f_2 x y z Sigma 6 7 and f x y z Sigma 1 4 5 f_3 is  Sigma 1 4 5 Sigma 6 7 Sigma 0 1 3 5 None of the above ,Canonical Normal Form
Given f_1 f_3 and f in canonical sum of products form in decimal for the circuit f_1 Sigma m 4 5 6 7 8 f_3 Sigma m 1 6 15 f Sigma m 1 6 8 15 hen f_2 is Sigma m 4 6 Sigma m 4 8 Sigma m 6 8 Sigma m 4 6 8 ,Canonical Normal Form
The minterm expansion of f P Q R PQ Q bar R P bar R is m_2 m_4 m_6 m_7 m_0 m_1 m_3 m_5 m_0 m_1 m_6 m_7 m_2 m_3 m_4 m_5 ,Canonical Normal Form
The total number of prime implicants of the function f w x y z sum 0 2 4 5 6 10 is __________,Canonical Normal Form
Given the function F P QR where F is a function in three Boolean variables P Q and R and P P consider the following statements S1 F sum 4 5 6 S2 F sum 0 1 2 3 7 S3 F Pi 4 5 6 S4 F Pi 0 1 2 3 7 Which of the following is true S1 False S2 True S3 True S4 False S1 True S2 False S3 False S4 True S1 False S2 False S3 True S4 True S1 True S2 True S3 False S4 False ,Canonical Normal Form
 A Boolean expression is an expression made out of propositional letters such as p q r and operators wedge vee and eg e g p wedge eg q vee eg r An expression is said to be in sum of product form also called disjunctive normal form if all eg occur just before letters and no vee occurs in scope of wedge e g p wedge eg q vee eg p wedge q The expression is said to be in product of sum form also called conjunctive normal form if all negations occur just before letters and no wedge occurs in the scope of vee e g p vee eg q wedge eg p vee q Which of the following is not correct Every Boolean expression is equivalent to an expression is sum of product form Every Boolean expression is equivalent to an expression in product of sum form Every Boolean expression is equivalent to an expression without vee operator Every Boolean expression is equivalent to an expression without wedge operator Every Boolean expression is equivalent to an expression without eg operator ,Canonical Normal Form
Given two three bit numbers a_ 2 a_ 1 a_ 0  and b_ 2 b_ 1 b_ 0  and c  the carry in the function  that represents the  carry  generate function when these two numbers are added  is  a_ 2 b_ 2 a_ 2 a_ 1 b_ 1 a_ 2 a_ 1 a_ 0 b_ 0 a_ 2 a_ 0 b_ 1 b_ 0 a_ 1 b_ 2 b_ 1 a_ 1 a_ 0 b_ 2 b_ 0 a_ 0 b_ 2 b_ 1 b_ 0 a_ 2 b_ 2 a_ 2 b_ 1 b_ 0 a_ 2 a_ 1 b_ 1 b_ 0 a_ 1 a_ 0 b_ 2 b_ 1 a_ 1 a_ 0 b_ 2 a_ 1 a_ 0 b_ 2 b_ 0 a_ 2 a_ 0 b_ 1 b_ 0 a_ 2 b_ 2 a_ 2 oplus b_ 2 a_ 1 b_ 1 a_ 1 oplus b_ 1 a_ 0 b_ 0 a_ 2 b_ 2 overline a_ 2 a_ 1 b_ 1 overline a_ 2 a_ 1 a_ 0 b_ 0 overline a_ 2 a_ 0 overline b_ 1 b_ 0 a_ 1 overline b_ 2 b_ 1 overline a_ 1 a_ 0 overline b_ 2 b_ 0 a_ 0 overline b_ 2 b_ 1 b_ 0 ,Carry Generator
In a look ahead carry generator the carry generate function G_i and the carry propagate function P_i for inputs A_i and B_i are given by P_i A_i oplus B_i ext  and G_i A_iB_i The expressions for the sum bit S_i and the carry bit C_ i 1 of the look ahead carry adder are given by S_i P_i oplus C_i ext and C_ i 1 G_i P_iC_i ext where C_0 ext  is the input carry Consider a two level logic implementation of the look ahead carry generator Assume that all  P_i and G_i are available for the carry generator circuit and that the AND and OR gates can have any number of inputs The number of AND gates and OR gates needed to implement the look ahead carry generator for a 4 bit adder with S_3 S_2 S_1 S_0 and C_4 as  its outputs are respectively 6 3 10 4 6 4 10 5 ,Carry Generator
Analyse the circuit in Fig below and complete the following table a b Q_n 0 0  0 1  1 0  1 1   ,Circuit Output
Multiple choices can be correct Mark all of them For the initial state of 000 the function performed by the arrangement of the J K flip flops in figure is Shift Register Mod 3 Counter Mod 6 Counter Mod 2 Counter None of the above ,Circuit Output
The logic expression for the output of the circuit shown in figure below is overline AC overline BC CD A overline C B overline C CD ABC overline C overline D overline A overline B overline B  overline C CD ,Circuit Output
Find the contents of the flip flop Q_2 Q_1 and Q_0 in the circuit of figure after giving four clock pulses to the clock terminal Assume Q_2Q_1Q_0 000 initially  ,Circuit Output
Consider the circuit in Fig 2 21 which has a four bit binary number b_3b_2b_1b_0 as input and a five bit binary number d_4d_3d_2d_1d_0 as output         Binary to Hex conversion Binary to BCD conversion Binary to grey code conversion Binary to radix 12 conversion ,Circuit Output
Consider the circuit in figure f implements overline A overline B C overline A B overline C ABC A B C A oplus B oplus C AB BC CA ,Circuit Output
Consider a logic circuit shown in figure below The functions f_1 f_2 ext and f in canonical sum of products form in decimal notation are f_1 w x y z sum 8 9 10 f_2 w x y z sum 7 8 12 13 14 15 f w x y z sum 8 9 The function f_3 is sum 9 10 sum 9 sum 1 8 9 sum 8 10 15 ,Circuit Output
Without any additional circuitry an 8 1 MUX can be used to obtain a Some but not all Boolean functions of 3 variables b All function of 3 variables but none of 4 variables c All functions of 3 variables and some but not all of 4 variables d All functions of 4 variables,Combinational
Which of the following is TRUE about formulae in Conjunctive Normal Form For any formula there is a truth assignment for which at least half the clauses evaluate to true For any formula there is a truth assignment for which all the clauses evaluate to true There is a formula such that for each truth assignment at most one fourth of the clauses evaluate to true None of the above ,Conjunctive Normal Form
How many 3 to 8 line decoders with an enable input are needed to construct a 6 to 64 line decoder without using any other logic gates 7 8 9 10  ,Decoder
A logic network has two data inputs A and B and two control inputs C_0 and C_1 It implements the function F according to the following table C_1 C_2 F 0 0 overline A B 0 1 A B 1 0 A oplus B  Implement the circuit using one 4 to 1 Multiplexer one 2 input Exclusive OR gate one 2 input AND gate one 2 input OR gate and one Inverter  ,Digital Circuits
In the following truth table V 1 if and only if the input is valid  Inputs Outputs D_0 D_1 D_2 D_3 X_0 X_1 V 0 0 0 0 x x 0 1 0 0 0 0 0 1 x 1 0 0 0 1 1 x x 1 0 1 0 1 x x x 1 1 1 1 What function does the truth table represent Priority encoder   Decoder   Multiplexer   Demultiplexer ,Digital Circuits
Consider the following combinational function block involving four Boolean variables x y a b where x a b are inputs and y is the output f x a b y if x is 1 y a else y b Which one of the following digital logic blocks is the most suitable for implementing this function Full adder Priority encoder Multiplexor Flip flop ,Digital Circuits
 We want to design a synchronous counter that counts the sequence 0 1 0 2 0 3 and then repeats The minimum number of ext J K  flip flops required to implement this counter is _____________ ,Digital Counter
The number of flip flops required to construct a binary modulo N counter is __________,Digital Counter
How many pulses are needed to change the contents of a 8 bit up counter from 10101100 to 00100111 rightmost bit is the LSB 134 133 124 123 ,Digital Counter
The minimum number of ext D flip flops needed to design a mod 258 counter is 9 8 512 258 ,Digital Counter
Let k 2 n A circuit is built by giving the output of an n bit binary counter as input to an n ext to 2 n  bit decoder This circuit is equivalent to a  k bit binary up counter  k bit binary down counter k bit ring counter k bit Johnson counter ,Digital Counter
Consider a 4 bit Johnson counter with an initial value of 0000 The counting sequence of this counter is  0 1 3 7 15 14 12 8 0 0 1 3 5 7 9 11 13 15 0 0 2 4 6 8 10 12 14 0 0 8 12 14 15 7 3 1 0 ,Digital Counter
The minimum number of JK flip flops required to construct a synchronous counter with the count sequence 0 0 1 1 2 2 3 3 0 0 is _______ ,Digital Counter
The dual of a Boolean function F x_1 x_2 dots x_n written as F D  is the same expression  as that of F with and u22c5 swapped F is said to be self dual if F F D  The number of self dual  functions with n Boolean variables is 2 n 2 n 1 2 2 n 2 2 n 1 ,Dual Function
The  n bit fixed point representation of an unsigned real number  X  uses  f  bits for the fraction part Let  i n f The range of decimal values for X in this representation is 2 f to  2 i 2 f to  left 2 i 2 f right 0 to  2 i 0 to  left 2 i 2 f right ,Fixed Point Representation
Find the maximum clock frequency at which the counter in the figure  below  can be operated Assume that the propagation delay through each flip flop and  each AND gate is 10 ext ns Also assume that the setup time for the JK  inputs of the flip flops is negligible ,Flip Flop
Design a 3 bit counter using D flip flops such that not more than one flip flop changes state between any two consecutive states ,Flip Flop
A sequential circuit takes an input stream of 0 s and 1 s and produces an output stream of 0 s and 1 s Initially it replicates the input on its output until two consecutive 0 s are encountered on the input From then onward it produces an output stream which is the bit wise complement of input stream until it encounters two consecutive 1 s whereupon the process repeats An example input and output stream is shown below The input stream 101100 01001011 0 11 The desired output 101100 10110100 0 11 J K master slave flip flops are to be used to design the circuit Give the state transition diagram,Flip Flop
In an SR latch made by cross coupling two NAND gates if both S and R inputs are set to 0 then it will result in Q 0 Q 1 Q 1 Q 0 Q 1 Q 1 Indeterminate states ,Flip Flop
A positive edge triggered D flip flop is connected to a positive edge triggered JK flip flop as follows The Q output of the D flip flop is connected to both the J and K inputs of the JK flip flop while the Q output of the JK flip flop is connected to the input of the D flip flop Initially the output of the D flip flop is set to logic one and the output of the JK flip flop is cleared Which one of the following is the bit sequence including the initial state generated at the Q output of the JK flip flop when the flip flops are connected to a free running common clock Assume that J K 1 is the toggle mode and J K 0 is the state holding mode of the JK flip flops Both the flip flops have non zero propagation delays 0110110 0100100 011101110 011001100 ,Flip Flop
Consider a combination of T and D flip flops connected as shown below The output of the D flip flop is connected to the input of the T flip flop  and the output of the T flip flop is connected to the input of the D flip flop Initially both  Q_ 0 and  Q_ 1 are set to 1 before the 1st  clock cycle The outputs Q_ 1 Q_ 0 after the 3rd  cycle are 11 and after the 4th  cycle are 00 respectively Q_ 1 Q_ 0 after the 3rd  cycle are 11 and after the 4th  cycle are 01  respectively Q_ 1 Q_ 0 after the 3rd  cycle are 00  and after the 4th  cycle are 11  respectively Q_ 1 Q_ 0 after the 3rd  cycle are 01 and after the 4th  cycle are 01  respectively ,Flip Flop
The exponent of a floating point number is represented in excess N code so that The dynamic range is large The precision is high The smallest number is represented by all zeros Overflow is avoided ,Floating Point Representation
A 32 bit floating point number is represented by a 7 bit signed exponent and a 24 bit fractional mantissa The base of the scale factor is 16 The range of the exponent is ___________,Floating Point Representation
The following is a scheme for floating point number representation using 16 bits Bit Position 15 14 9 8 0  s e m  Sign Exponent Mantissa Let  s e  and  m  be the numbers represented in binary in the sign exponent and mantissa fields respectively Then the floating point number represented is begin cases 1 s left 1 m imes 2 9 right 2 e 31 amp ext if the exponent eq 111111  0 amp ext otherwise end cases What is the maximum difference between two successive real numbers representable in this system 2 40 2 9 2 22 2 31 ,Floating Point Representation
Consider the following floating point format       Mantissa is a pure fraction in sign magnitude form The decimal number 0 239 imes 2 13 has the following hexadecimal representation without normalization and rounding off 0D 24 0D 4D 4D 0D 4D 3D ,Floating Point Representation
Consider the following floating point format Mantissa is a pure fraction in sign magnitude form The normalized representation for the above format is specified as follows The mantissa has an implicit 1 preceding the binary radix point Assume that only 0 u2019s are padded in while shifting a field The normalized representation of the above number 0 239 imes 2 13 is 0A 20 11 34 49 D0 4A E8 ,Floating Point Representation
Given the following binary number in 32 bit single precision IEEE 754 format                                     large 00111110011011010000000000000000 The decimal value closest to this floating point number is 1 45 10 1 1 45 10 1 2 27 10 1 2 27 10 1 ,Floating Point Representation
 The implication gate shown below has two inputs x ext and y the output is 1 except when x 1 ext and y 0 ext realize f bar x y x bar y using only four implication gates Show that the implication gate is functionally complete  ,Functional Completeness
Which of the following sets of component s is are sufficient to implement any arbitrary Boolean function XOR gates NOT gates 2 to 1 multiplexers AND gates XOR gates Three input gates that output A B C for the inputs A B and C  ,Functional Completeness
A set of Boolean connectives is functionally complete if all Boolean functions can be synthesized using those Which of the following sets of connectives is NOT functionally complete EX NOR implication negation OR negation NAND ,Functional Completeness
Consider numbers represented in 4 bit Gray code Let h_ 3 h_ 2 h_ 1 h_ 0  be the Gray code  representation of a number n and let g_ 3 g_ 2 g_ 1 g_ 0 be the Gray code of n 1 modulo 16  value of the number Which one of the following functions is correct g_ 0 h_ 3 h_ 2 h_ 1 h_ 0 sum 1 2 3 6 10 13 14 15 g_ 1 h_ 3 h_ 2 h_ 1 h_ 0 sum 4 9 10 11 12 13 14 15 g_ 2 h_ 3 h_ 2 h_ 1 h_ 0 sum 2 4 5 6 7 12 13 15 g_ 3 h_ 3 h_ 2 h_ 1 h_ 0 sum 0 1 6 7 10 11 12 13 ,Gray Code
A half adder is implemented with XOR and AND gates A full adder is implemented with  two half adders and one OR gate The propagation delay of an XOR gate is twice that of an AND OR gate The propagation delay of an AND OR gate is 1 2 microseconds A 4 bit ripple carry binary adder is implemented by using four full adders The total propagation time of this 4 bit binary adder in microseconds is ______ ,Half Adder
In the IEEE floating point representation the hexadecimal value 0 ext x 00000000 corresponds to The normalized value 2 127 The normalized value 2 126 The normalized value 0 The special value 0 ,Ieee Representation
The following bit pattern represents a floating point number in IEEE 754 single precision format 1 10000011 101000000000000000000000 The value of the number in decimal form is 10 13 26 None of the above ,Ieee Representation
The decimal value 0 5 in IEEE single precision floating point representation has fraction bits of 000 dots 000 and exponent value of 0 fraction bits of 000 dots 000 and exponent value of u22121 fraction bits of 100 dots 000 and exponent value of 0 no exact representation ,Ieee Representation
A Boolean function f is to be realized only by NOR gates Its K map is given below The realization is ,K Map
The Boolean function in sum of products form where K map is given below figure is _______ ,K Map
What is the equivalent Boolean expression in product of sums form for the Karnaugh map given in Fig B overline D overline B D B overline C D overline B C overline D B D overline B overline D B overline D overline B D  ,K Map
The function represented by the Karnaugh map is given below is A B AB BC CA overline B oplus C A BC  ,K Map
Which of the following functions implements the Karnaugh map shown below CD 00 01 11 10 AB 00 0 0 1 0 01 X X 1 X 11 0 1 1 0 10 0 1 1 0  bar A B CD D C A AD bar A B C D bar C D A B  ,K Map
Which functions does NOT implement the Karnaugh map given below                      w x y xy yw w x bar w y bar x y None of the above ,K Map
Given the following karnaugh map which one of the following represents the minimal Sum Of Products of the map XY Y Z WX Y XY XZ W X Y Z XY XZ Y ,K Map
Choose the correct alternatives more than one may be correct and write the corresponding letters only All digital circuits can be realized using only Ex OR gates Multiplexers Half adders OR gates ,Logic Gates
 Express the function f x y z xy yz with only one complement operation and one or more AND OR operations Draw the logic circuit implementing the expression obtained using a single NOT gate and one or more AND OR gates Transform the following logic circuit without expressing  its switching function into an equivalent logic circuit that employs only 6 NAND gates each with 2 inputs  ,Logic Gates
Consider the following circuit composed of XOR gates and non inverting buffers The non inverting buffers have delays delta_1 2 ns and delta_2 4 ns as shown in the figure Both XOR gates and all wires have zero delay Assume that all gate inputs outputs and wires are stable at logic level 0 at time 0 If the following waveform is applied at input A how many transition s change of logic levels occur s at B during the interval from 0 to 10 ns 1 2 3 4 ,Logic Gates
Which one of the following circuits is  NOT  equivalent to a 2 input XNOR exclusive NOR gate  ,Logic Gates
The Boolean function obtained by adding an inverter to each and every input of an AND gate is OR XOR NAND NOR None of the above ,Logic Gates
Design a logic circuit to convert a single digit BCD number to the number modulo six as follows Do not detect illegal input Write the truth table for all bits Label the input bits I1 I2 with I1 as the least significant bit Label the output bits R1 R2 with R1 as the least significant bit Use 1 to signify truth Draw one circuit for each output bit using altogether two two input AND gates one two input  OR gate and two NOT gates  ,Min No Gates
A circuit outputs a digit in the form of 4 bits 0 is represented by 0000 1 by 0001 u2026 9 by 1001 A combinational circuit is to be designed which takes these 4 bits as input and outputs 1 if the digit geq 5 and 0 otherwise If only AND OR and NOT gates may be used what is the minimum number of gates required 2 3 4 5 ,Min No Gates
What is the minimum number of NAND gates required to implement a 2 input EXCLUSIVE OR function without using any other logic gate 2 4 5 6 ,Min No Gates
What is the minimum number of gates required to implement the Boolean function AB C if we have to use only 2 input NOR gates 2 3 4 5  ,Min No Gates
Given f w x y z Sigma_m 0 1 2 3 7 8 10 Sigma_d 5 6 11 15 where d represents the don t care condition in Karnaugh maps Which of the following is a minimum product of sums POS form of f w x y z f bar w bar z bar x z f bar w z x z f w z bar x z f w bar z bar x z ,Min Product Of Sums
Three switching functions f_1 f_2 and f_3 are expressed below as sum of minterms f_1 w x y z sum 0 1 2 3 5 12 f_2 w x y z sum 0 1 2 10 13 14 15 f_3 w x y z sum 2 4 5 8 Express the function f realised by the circuit shown in the below figure as the sum of minterms in decimal notation ,Min Sum Of Products Form
Find the minimum sum of products form of the logic function f A B C D Sigma m 0 2 8 10 15 Sigma d 3 11 12 14 where m and d represent minterm and don t care term respectively ,Min Sum Of Products Form
Let f bar w y bar x y w bar x z bar w z bar x z Express f as the minimal sum of products Write only the answer If the output line is stuck at 0 for how many input combinations will the value of f be correct ,Min Sum Of Products Form
 Is the 3 variable function f Sigma 0 1 2 4 its self dual Justify your answer Give a minimal product of sum form of the b output of the following excess 3 to BCD converter  ,Min Sum Of Products Form
The switching expression corresponding to f A B C D Sigma 1 4 5 9 11 12 is BC u2019D u2019 A u2019C u2019D AB u2019D ABC u2019 ACD B u2019C u2019D ACD u2019 A u2019BC u2019 AC u2019D u2019 A u2019BD ACD u2019 BCD u2019 ,Min Sum Of Products Form
Consider the following Boolean function of four variables f w x y z Sigma 1 3 4 6 9 11 12 14 The function is independent of one variables independent of two variables independent of three variables dependent on all variables ,Min Sum Of Products Form
Consider the following Boolean function of four variables f A B C D u03a3 2 3 6 7 8 9 10 11 12 13 The function is independent of one variable independent of two variables independent of three variable dependent on all the variables ,Min Sum Of Products Form
A  1 input 2 output synchronous sequential circuit behaves as follows Let z_k n_k denote the number of 0 u2019s and 1 u2019s respectively in initial k bits of the input z_k n_k k The circuit outputs 00 until one of the following conditions holds z_k n_k 2 In this case the output at the k th and all subsequent clock ticks is 10 n_k z_k 2 In this case the output at the k th and all subsequent clock ticks is 01 What is the minimum number of states required in the state transition graph of the above circuit 5 6 7 8 ,Minimal State Automata
Following is a state table for time finite state machine Present State Next State Output Input 0 Input 1 A B C D E F G H B 1 F 1 D 0 C 0 D 1 C 1 C 1 C 0 H 1 D 1 E 1 F 1 C 1 C 1 D 1 A 1 Find the equivalence partition on the states of the machine Give the state table for the minimal machine Use appropriate names for the equivalent states For example if states X and Y are equivalent then use XY as the name for the equivalent state in the minimal machine ,Minimal State Automata
Consider the two cascade 2 to 1 multiplexers as shown in the figure     The minimal sum of products form of the output X is  overline P overline Q PQR overline P Q QR PQ overline P overline Q R overline Q overline R PQR ,Multiplexer
